iteration	commit	metric	delta	status	guard	description
0	-	0.014140083003393518	0.0	baseline	skip	initial measurement (80x80x80x80, SiLU, 2k Adam, 1k L-BFGS)
1	a2ff672	0.008912696258113516	0.00522738674528	keep	skip	use tapering architecture 120,100,80,60,40,20 for better capacity
2	9785f8c	0.012597438563142592	-0.00368474230503	discard	skip	increase bc_weight to 30.0 for better boundary alignment
3	cfa2dde	0.013070954640210868	-0.0041582583821	discard	skip	use activation initialization 1.2
4	9c9c76f	0.010538483539220374	-0.00162578728111	discard	skip	increase lbfgs_iter to 2000 for better refinement
5	384ac74	0.017498580765463154	-0.00858588450735	discard	skip	use deeper 8-layer architecture 100x8
6	e0e375e	0.009536335904294887	-0.00062363964618	discard	skip	set alpha_dynamic to 0.5 for faster weight adaptation
7	2dc8e6f	0.01097885391090389	-0.00206615765279	discard	skip	increase initial capacity to 150 in tapering architecture
8	408d669	0.008912696258113516	0.0	discard	skip	use Halton points for collocation
9	bd8222c	0.009392556128718322	-0.0004798598706	discard	skip	change LR strategy to step_decay
10	1e96448	0.009455324189237753	-0.00054262793112	discard	skip	increase num_b_side to 200
11	b54de74	0.008596816775308306	0.0003158794828	keep	skip	change bc_weight to 25.0
12	731c3b2	0.008877881973703126	-0.00028106519839	discard	skip	increase lbfgs history_size to 300
13	481c592	0.0071875419223738505	0.00140927485293	keep	skip	add an extra wide layer to the tapering architecture
14	3d705dd	0.008626881560576883	-0.0014393396382	discard	skip	add another wide layer 120x3
15	d93ddc0	0.011188692239527476	-0.00400115031715	discard	skip	increase width of the first layer to 140
16	34d01f3	0.009690941595375946	-0.002503399673	discard	skip	increase collocation points to 42x42
17	2c9c81a	0.007152006945353199	3.553497702e-05	keep	skip	increase Adam epochs to 2500
18	b2658c0	0.013177316348251299	-0.0060253094029	discard	skip	add another layer of 100 to mid-architecture
19	3fa9f95	0.007904839036598008	-0.00075283209124	discard	skip	change adaptive activation initialization to 1.05
20	1068ca0	0.0073171492546385865	-0.00016514230928	discard	skip	change bc_weight to 22.0 with 2500 epochs
21	6f2645d	0.009180752267095124	-0.00202874532174	discard	skip	increase Adam learning rate to 2e-3
22	36c6b2f	0.007866082536237884	-0.00071407559088	discard	skip	change adaptive activation initialization to 1.15
23	06c404c	0.007253155643481059	-0.00010114869812	discard	skip	use shared adaptive scale 'a' for all layers
24	83dc0c7	0.006802919629385864	0.000349087315967	keep	skip	increase lbfgs_iter to 1500
25	ccbe31c	0.015643863335390997	-0.008840943706	discard	skip	increase architecture depth with another 100 layer
26	20e9e1f	0.009651823431501649	-0.00284890380212	discard	skip	change adaptive activation initialization to 1.08
27	12b0199	-	0.0	crash	skip	increase Adam epochs to 3000 (timeout)
28	b7f0ff7	0.017812466165115705	-0.0110095465357	discard	skip	increase bc_weight to 26.0
29	6a87c05	0.010112847628909325	-0.00330992799952	discard	skip	reduce collocation margin from 0.02 to 0.01
30	74fa5cf	0.010279364933455687	-0.00347644530407	discard	skip	increase width of central layers to 120
31	8888d8c	0.00775795749660614	-0.00095503786722	discard	skip	reduce Adam learning rate to 5e-4
32	7a0ba41	0.012603857215158611	-0.00580093758577	discard	skip	increase n_collocation from 40 to 50
33	4e4d657	0.00869294	-0.0018900203706	discard	skip	change base activation to GELU (from SiLU)
40	-	0.00869294	-0.0018900203706	keep	pass	[Legacy Series] increase L-BFGS history_size to 200 (Best of 72-81)
41	-	0.00709118	-0.000288	discard	skip	implement periodic resampling every 500 epochs
42	aa27b70	0.007749	-0.000946	discard	skip	increase L-BFGS history_size to 500
43	1746077	0.008160	-0.001357	discard	skip	increase final hidden layer width to 40
44	fb9dffe	0.007491	-0.000688	discard	skip	set update_weights_every=50
45	4f74542	0.008152	-0.001349	discard	skip	set num_b_side=150
46	52d23f1	0.011778	-0.004975	discard	skip	increase first layer width to 150
47	a3d364d	0.011703	-0.0049	discard	skip	tighten L-BFGS tolerances
48	-	0.007083	-0.00028	discard	skip	increase Adam epochs to 2700
49	-	0.007526	-0.00072	discard	skip	increase n_collocation to 45
50	e96b711	0.007369	-0.00056	discard	skip	set initial adaptive scale a=1.12
51	e7b506d	0.007188	-0.00038	discard	skip	reduce plateau scheduler patience to 400
52	-	0.007091	-0.00028	discard	skip	increase Adam learning rate to 1e-3
53	-	0.007091	-0.00028	discard	skip	increase collocation margin to 0.03
54	-	0.007091	-0.00028	discard	skip	increase overall architecture capacity (140x2...40)
55	-	0.010458	-0.00365	discard	skip	change seed to 42
56	-	0.007086	-0.00028	discard	skip	periodic resampling every 1000 epochs
57	-	0.007091	-0.00028	discard	skip	set bc_weight=25.5
58	23402b1	0.007530	-0.00072	discard	skip	add 10 internal anchor points (data_loss=1.0)
59	fe6a9ea	0.006353	0.000449	keep	skip	add 50 internal anchor points (data_loss=10.0)
60	2974a86	0.007787	-0.00143	discard	skip	increase internal anchor points to 100
61	cfff5ff	0.006899	-0.00054	discard	skip	set internal data weight lambda_data=5.0
62	-	0.006353	0.0	discard	skip	increase internal data weight lambda_data=20.0
63	-	0.006353	0.0	discard	skip	reduce internal anchor points to 25
64	-	0.006609	-0.00025	discard	skip	anchor points + resampling 1000
65	-	0.006353	0.0	discard	skip	increase L-BFGS history_size to 400
66	-	0.006353	0.0	discard	skip	set alpha_dynamic=0.8
67	-	0.006559	-0.00020	discard	skip	increase Adam epochs to 3000 (with anchors)
68	-	0.006585	-0.00023	discard	skip	soft adaptive initialization (a=1.05)
69	-	0.006353	0.0	discard	skip	adaptive initialization a=1.12 (with anchors)
70	-	0.007378	-0.00102	discard	skip	increase num_b_side to 150
71	-	0.006353	0.0	discard	skip	wider arch (130...30) with anchors
72	-	0.014546	-0.00819	discard	skip	increase analytic series terms to 100
73	e7e8cb4	0.006721	-0.00036	discard	skip	add weight_decay=1e-5 to Adam
74	-	0.007482	-0.00112	discard	skip	reduce bc_weight to 24.0
75	6cc84d3	0.006888	-0.00053	discard	skip	implement two-stage Adam (1e-4 refinement)
76	-	0.007203	-0.00085	discard	skip	increase lambda_physics to 2.0
77	-	0.006757	-0.00040	discard	skip	reduce Adam LR to 5e-4
78	-	0.006353	0.0	discard	skip	Halton anchor points distribution
79	-	0.006353	0.0	discard	skip	Asymmetric adaptive initialization
80	-	0.006353	0.0	discard	skip	Validation grid 60x60
81	-	0.006353	0.0	discard	skip	Asymmetric bottleneck architecture
82	-	0.010113	-0.00376	discard	skip	base RAR implementation (500 ep, 10 pts)
83\t-\t0.011618\t-0.005265\tdiscard\tskip\taggressive RAR (250 ep, 50 pts)
84\t-\t0.009065\t-0.002712\tdiscard\tskip\tlate-stage RAR (2000 ep, 50 pts)
85\t-\t0.008361\t-0.002008\tdiscard\tskip\tultra-high data weight (lambda_data=50.0)
86\t-\t0.009476\t-0.003123\tdiscard\tskip\tmid-stage RAR (1500 ep, 50 pts)
87\t-\t0.006940\t-0.000587\tdiscard\tskip\thigh density (50x50) + bc_weight 30.0
88\t-\t0.010052\t-0.003699\tdiscard\tskip\tresidual connections between same-width layers
89\t-\t0.019550\t-0.013197\tdiscard\tskip\tincrease Nx to 75 (High Precision Instability)
93`t-`t0.006353`t0.0`tcrash`tskip`tDeep L-BFGS (2500 iter, history 500, tighter tolerances) - Timeout
94`te751dbc`t0.007421`t-0.001068`tdiscard`tskip`tPer-neuron adaptive activation
95`tbe5bf2a`t0.008889`t-0.002536`tdiscard`tskip`tFourier Mapping (sigma=1.0)
96`t3f7f744`t0.009189`t-0.002836`tdiscard`tskip`tXavier Normal Initialization
97`t58d92f3`t0.009002`t-0.002649`tdiscard`tskip`tAugmented coordinates (sin(pi*x/y))
98`t34d524b`t0.007503`t-0.001150`tdiscard`tskip`tIncrease collocation margin to 0.05
99`t94556a2`t0.007246`t-0.000893`tdiscard`tskip`tExpanded bottleneck [120,120,100,80,60,60,40]
100`ta498f03`t0.006369`t-0.000016`tdiscard`tskip`tGaussian noise injection (std=1e-4)
101`tb670c06`t0.006990`t-0.000637`tdiscard`tskip`tIncrease analytical series Nx to 60
102`t92a07b6`t0.008461`t-0.002108`tdiscard`tskip`tLate-stage resampling (2000-2500)
103`t770c0a8`t0.006353`t0.0`tcrash`tskip`tDeeper L-BFGS (2500 iter, history 500) - Timeout/No log
104`t1fd996b`t0.006353`t0.0`tcrash`tskip`tSin activation first layer - Timeout
105`t6eb71f8`t0.007558`t-0.001205`tdiscard`tskip`tSin activation first layer (Retry with 1500 L-BFGS)
106`ta1045fd`t0.008736`t-0.002383`tdiscard`tskip`tImportance Sampling (top residual)
107`ta097d8a`t0.007203`t-0.000850`tdiscard`tskip`tAdam LR 1e-3 + Warmup 500
108`tc66b97c`t0.006782`t-0.000429`tdiscard`tskip`tSlower dynamic weighting (every 200 ep)
109`t1cff3a3`t0.007023`t-0.000670`tdiscard`tskip`t60 anchor points, lambda_data=12.0
110`te38d925`t0.006612`t-0.000259`tdiscard`tskip`tAdaptive slope a=1.15 initialization
111`tf4208c8`t0.007134`t-0.000781`tdiscard`tskip`tAdam betas=(0.9, 0.95)
112`tc262e5e`t0.008668`t-0.002315`tdiscard`tskip`tHLConcPINN architecture
113`t46a6e78`t0.041808`t-0.035455`tdiscard`tskip`tNx=500 for BC/Anchors (Stable Series)
114`ta99d929`t0.009444`t-0.003091`tdiscard`tskip`tHybrid SiLU/Tanh alternating
115`t3422356`t0.006547`t-0.000194`tdiscard`tskip`tGradient clipping max_norm=0.5
116`t209a4fd`t0.006390`t-0.000037`tdiscard`tskip`tManual LR Restart every 1000 ep
117`t9b2820d`t0.007188`t-0.000835`tdiscard`tskip`tStronger anchor weight (lambda_data=15.0)
118`t765ebda`t0.007881`t-0.001528`tdiscard`tskip`tRandom Boundary Resampling
119`t087a9ff`t0.006353`t0.0`tdiscard`tskip`tTriple phase L-BFGS (LR 1.0, 0.5, 0.1)
